{
  "$comment": "GENERATED by bun nv render — do not edit",
  "$schema": "https://json-schema.org/draft/2020-12/schema",
  "title": "playbook_bullet",
  "type": "object",
  "properties": {
    "lead": {
      "type": "string"
    },
    "body": {
      "type": "string"
    },
    "files": {
      "type": "array",
      "items": {
        "type": "string"
      }
    },
    "until": {
      "type": "object",
      "properties": {
        "kind": {
          "enum": [
            "test",
            "exists",
            "gone",
            "rule"
          ]
        },
        "arg": {
          "type": "string"
        }
      },
      "required": [
        "kind",
        "arg"
      ],
      "additionalProperties": false
    }
  },
  "required": [
    "lead",
    "body",
    "files",
    "until"
  ],
  "additionalProperties": false
}
