{
  "lead": "A diagnostic reported at a read fires a second time on a declaration another diagnostic already refused, and the cases it turns red look unrelated.",
  "body": "`E0792` — a class constant whose value folds to nothing — is reported at the read on purpose, and then reported over the top of `E0246` (`const LIMIT = 9;` has no type, so it folds to nothing *because* it was refused) and `E0727` (`const secret bytes BLOB = \"b\";` cannot fold because there is no `bytes` literal). Before reporting on a use of a declaration, return early for each type another diagnostic already refused, naming it. See `crates/nvs-diagnostics/src/lib.rs`.",
  "files": [
    "crates/nvs-diagnostics/src/lib.rs"
  ],
  "until": {
    "kind": "gone",
    "arg": "crates/nvs-diagnostics/src/lib.rs:E0792"
  }
}
