{
  "lead": "A `.nvs` under `docs/examples/` or `tests/hostile/` that opens a database needs its own `[[app]] entry` block in `nvs.toml`, written after the file exists.",
  "body": "A `db.connect` grant is per entry path and the `root = \".\"` block carries none, and a block naming a path not yet on disk stops *every* program in the tree with `E0605`. Point it at `[db.schema]` — in-memory SQLite, no container — and grant `connect` alone, which is enough to `create table`.",
  "files": [
    "docs/examples/",
    "tests/hostile/",
    "nvs.toml"
  ],
  "until": {
    "kind": "gone",
    "arg": "nvs.toml:db.connect"
  }
}
