{
  "lead": "A `.nvst` case gets exactly one in-process request, and the child's deferred output has nowhere to go.",
  "body": "`Core\\Test::request` is refused from inside the request it answers, and `runner.rs`'s `answer` takes the `Completion` before the deferred queue drains, so an `afterResponse` `echo` reaches a buffer nobody reads. Pin a cross-request claim at the boot (`[session] backend = \"local\"` is `E0626`) and an after-the-answer claim from the caller's side.",
  "files": [
    "crates/nvs-stdlib/src/test.rs"
  ],
  "until": {
    "kind": "gone",
    "arg": "crates/nvs-stdlib/src/test.rs:Core\\Test::request"
  }
}
